{
  "schema_version": 1,
  "fixture_set_id": "audio_world_surface:fixtures:2026-04-29",
  "schema_ref": "schemas/audio-world-surface-fixtures.schema.json",
  "generated_from": [
    "vault:20-projects/hapax-research/specs/2026-04-29-audio-reference-world-surface.md",
    "vault:20-projects/hapax-research/specs/2026-04-29-world-surface-health-no-false-grounding.md",
    "vault:20-projects/hapax-research/audits/2026-04-29-recent-research-orphan-replenishment-audit.md"
  ],
  "declared_at": "2026-04-29T17:12:00Z",
  "producer": "cx-amber",
  "health_states": [
    "safe",
    "quiet_off_air",
    "degraded",
    "unsafe",
    "broken",
    "blocked_absent",
    "stale",
    "unknown"
  ],
  "witness_classes": [
    {
      "witness_class": "public_audio_witness",
      "privacy_scope": "public",
      "required_evidence_classes": [
        "semantic_route_binding",
        "egress_marker",
        "signal_presence",
        "loudness_band",
        "privacy_no_leak",
        "grounding_gate_when_factual"
      ],
      "raw_target_assumptions_allowed": false,
      "description": "Public audio requires semantic route binding plus observed broadcast egress; commanded speech alone is not evidence."
    },
    {
      "witness_class": "private_audio_witness",
      "privacy_scope": "private",
      "required_evidence_classes": [
        "semantic_route_binding",
        "exact_private_target",
        "private_marker",
        "broadcast_clean"
      ],
      "raw_target_assumptions_allowed": false,
      "description": "Private audio requires the exact private monitor target and proof that the marker did not leak to broadcast."
    },
    {
      "witness_class": "no_leak_audio_witness",
      "privacy_scope": "no_leak",
      "required_evidence_classes": [
        "leak_guard_pass",
        "private_route_isolation",
        "broadcast_egress_clean"
      ],
      "raw_target_assumptions_allowed": false,
      "description": "No-leak status is its own witness class and cannot be inferred from route names or private intent."
    },
    {
      "witness_class": "route_binding_witness",
      "privacy_scope": "route",
      "required_evidence_classes": ["media_role_exists", "target_exists", "expected_link_exists"],
      "raw_target_assumptions_allowed": false,
      "description": "Route binding proves a semantic destination maps to a concrete target binding, not that the world effect happened."
    },
    {
      "witness_class": "freshness_witness",
      "privacy_scope": "freshness",
      "required_evidence_classes": ["checked_at", "ttl", "source_mtime_or_probe_time"],
      "raw_target_assumptions_allowed": false,
      "description": "Freshness must be measured; stale or missing measurement fails closed."
    },
    {
      "witness_class": "health_witness",
      "privacy_scope": "health",
      "required_evidence_classes": ["health_object", "blocking_reasons", "warnings", "evidence_refs"],
      "raw_target_assumptions_allowed": false,
      "description": "Health rows project evidence and blockers; they do not grant public claim authority."
    }
  ],
  "route_result_required_fields": [
    "semantic_destination",
    "concrete_target_binding",
    "privacy_posture",
    "fallback_policy",
    "witness_class",
    "freshness",
    "failure_reason"
  ],
  "audio_surface_rows": [
    {
      "schema_version": 1,
      "surface_id": "audio.broadcast_voice",
      "label": "Broadcast voice",
      "world_capability_ref": "audio.broadcast_voice",
      "semantic_destination": "broadcast_public",
      "surface_role": "expression",
      "grounding_status": "public_claim_bearing",
      "health_state": "unknown",
      "route_result": {
        "semantic_destination": "broadcast_public",
        "concrete_target_binding": {
          "binding_id": "binding:broadcast_voice",
          "media_role": "Broadcast",
          "target_ref": "pipewire:role-broadcast",
          "route_id": "route:broadcast.voice",
          "substrate_ref": "audio.broadcast_voice",
          "concrete_interface": "Broadcast role to hapax-voice-fx-capture and livestream tap",
          "raw_high_level_target_assumption": false,
          "implementation_truth_source_refs": ["config:audio-topology.yaml", "shared:broadcast_audio_health"]
        },
        "privacy_posture": "public_candidate",
        "fallback_policy": {
          "mode": "block_public_speech",
          "reason_code": "broadcast_witness_missing",
          "prohibited_fallback_refs": ["route:assistant", "route:private", "pipewire:default"],
          "operator_visible_reason": "Public narration is blocked until route, egress, no-leak, and grounding witnesses pass."
        },
        "witness_class": "public_audio_witness",
        "freshness": {
          "state": "unknown",
          "ttl_s": 5,
          "checked_at": null,
          "evidence_ref": null
        },
        "failure_reason": "seed_fixture_no_live_public_witness"
      },
      "public_claim_allowed": false,
      "blocked_reasons": ["seed_fixture_not_runtime_truth", "broadcast_egress_marker_missing"],
      "notes": "High-level code must request broadcast_public; Assistant/private targets cannot satisfy public narration."
    },
    {
      "schema_version": 1,
      "surface_id": "audio.private_assistant_monitor",
      "label": "Private assistant monitor",
      "world_capability_ref": "audio.private_assistant_monitor",
      "semantic_destination": "private_assistant",
      "surface_role": "expression",
      "grounding_status": "non_grounding_private",
      "health_state": "blocked_absent",
      "route_result": {
        "semantic_destination": "private_assistant",
        "concrete_target_binding": {
          "binding_id": "binding:private_assistant_monitor",
          "media_role": "Assistant",
          "target_ref": "pipewire:hapax-private-monitor-capture",
          "route_id": "route:private.assistant_monitor",
          "substrate_ref": "audio.private_assistant_monitor",
          "concrete_interface": "Assistant role to private monitor bridge and mk5 Phones private-monitor target",
          "raw_high_level_target_assumption": false,
          "implementation_truth_source_refs": ["config:audio-topology.yaml", "config:pipewire/private-monitor-bridge"]
        },
        "privacy_posture": "private_only",
        "fallback_policy": {
          "mode": "blocked_absent_silence",
          "reason_code": "private_monitor_target_absent",
          "prohibited_fallback_refs": ["pipewire:default", "route:l12", "route:broadcast", "route:multimedia"],
          "operator_visible_reason": "Private assistant audio remains silent when the exact monitor target is absent."
        },
        "witness_class": "private_audio_witness",
        "freshness": {
          "state": "blocked_absent",
          "ttl_s": 5,
          "checked_at": null,
          "evidence_ref": null
        },
        "failure_reason": "private_monitor_presence_not_witnessed"
      },
      "public_claim_allowed": false,
      "blocked_reasons": ["seed_fixture_not_runtime_truth", "mk5_private_target_not_witnessed"],
      "notes": "Missing mk5 private monitor or orphaned playback is blocked_absent and must not fallback to public audio."
    },
    {
      "schema_version": 1,
      "surface_id": "audio.private_notification_monitor",
      "label": "Private notification monitor",
      "world_capability_ref": "audio.private_notification_monitor",
      "semantic_destination": "private_notification",
      "surface_role": "expression",
      "grounding_status": "non_grounding_private",
      "health_state": "blocked_absent",
      "route_result": {
        "semantic_destination": "private_notification",
        "concrete_target_binding": {
          "binding_id": "binding:private_notification_monitor",
          "media_role": "Notification",
          "target_ref": "pipewire:hapax-notification-private",
          "route_id": "route:private.notification_monitor",
          "substrate_ref": "audio.private_notification_monitor",
          "concrete_interface": "Notification role to private notification monitor bridge and mk5 Phones private-monitor target",
          "raw_high_level_target_assumption": false,
          "implementation_truth_source_refs": ["config:audio-topology.yaml", "config:pipewire/private-notification-monitor"]
        },
        "privacy_posture": "private_only",
        "fallback_policy": {
          "mode": "blocked_absent_silence",
          "reason_code": "notification_monitor_target_absent",
          "prohibited_fallback_refs": ["pipewire:default", "route:l12", "route:broadcast", "route:multimedia"],
          "operator_visible_reason": "Private notifications remain silent when the exact private monitor target is absent."
        },
        "witness_class": "private_audio_witness",
        "freshness": {
          "state": "blocked_absent",
          "ttl_s": 5,
          "checked_at": null,
          "evidence_ref": null
        },
        "failure_reason": "notification_private_monitor_not_witnessed"
      },
      "public_claim_allowed": false,
      "blocked_reasons": ["seed_fixture_not_runtime_truth", "private_notification_marker_missing"],
      "notes": "Notification privacy is distinct from public broadcast health."
    },
    {
      "schema_version": 1,
      "surface_id": "audio.programme_audio",
      "label": "Programme audio",
      "world_capability_ref": "audio.programme_audio",
      "semantic_destination": "programme_audio",
      "surface_role": "expression",
      "grounding_status": "public_claim_bearing",
      "health_state": "degraded",
      "route_result": {
        "semantic_destination": "programme_audio",
        "concrete_target_binding": {
          "binding_id": "binding:programme_audio",
          "media_role": "Programme",
          "target_ref": "policy:programme-audio-route",
          "route_id": "route:programme.audio",